{
 "archived": false,
 "created_at": "2026-05-24T14:01:56Z",
 "default_branch": "main",
 "description": "Create branded CompleteTech LLC invoice PDFs for agentic development services, from deposit through final payment.",
 "fork": false,
 "has_discussions": false,
 "has_issues": true,
 "has_projects": true,
 "has_wiki": false,
 "health_percentage": 75,
 "homepage": "",
 "is_template": false,
 "labels": [
  {
   "color": "d73a4a",
   "description": "Something isn't working",
   "name": "bug"
  },
  {
   "color": "0075ca",
   "description": "Improvements or additions to documentation",
   "name": "documentation"
  },
  {
   "color": "cfd3d7",
   "description": "This issue or pull request already exists",
   "name": "duplicate"
  },
  {
   "color": "a2eeef",
   "description": "New feature or request",
   "name": "enhancement"
  },
  {
   "color": "7057ff",
   "description": "Good for newcomers",
   "name": "good first issue"
  },
  {
   "color": "008672",
   "description": "Extra attention is needed",
   "name": "help wanted"
  },
  {
   "color": "e4e669",
   "description": "This doesn't seem right",
   "name": "invalid"
  },
  {
   "color": "d876e3",
   "description": "Further information is requested",
   "name": "question"
  },
  {
   "color": "ffffff",
   "description": "This will not be worked on",
   "name": "wontfix"
  }
 ],
 "language": "Python",
 "languages": {
  "Mermaid": 527,
  "Python": 62124
 },
 "license": "MIT",
 "owner": "CompleteTech-Skills",
 "repo": "agentic-invoice-skill",
 "stargazers_count": 0,
 "topics": [
  "agentic-development",
  "agentic-workflows",
  "billing",
  "claude-skill",
  "codex-skill",
  "completetech",
  "invoice",
  "pdf-generator"
 ],
 "visibility": "public"
}