{
 "archived": false,
 "created_at": "2026-10-21T14:09:53Z",
 "default_branch": "main",
 "description": "Read-only ServiceDesk Plus on-premises assessment for cloud migration readiness",
 "fork": false,
 "has_discussions": false,
 "has_issues": true,
 "has_projects": true,
 "has_wiki": false,
 "health_percentage": 50,
 "homepage": null,
 "is_template": false,
 "labels": [
  {
   "color": "f143ab",
   "description": "Barrier affecting people with disabilities",
   "name": "accessibility"
  },
  {
   "color": "d73a4a",
   "description": "Something isn't working",
   "name": "bug"
  },
  {
   "color": "0075ca",
   "description": "Improvements or additions to documentation",
   "name": "documentation"
  },
  {
   "color": "cfd3d7",
   "description": "This issue or pull request already exists",
   "name": "duplicate"
  },
  {
   "color": "a2eeef",
   "description": "New feature or request",
   "name": "enhancement"
  },
  {
   "color": "7057ff",
   "description": "Good for newcomers",
   "name": "good first issue"
  },
  {
   "color": "008672",
   "description": "Extra attention is needed",
   "name": "help wanted"
  },
  {
   "color": "e4e669",
   "description": "This doesn't seem right",
   "name": "invalid"
  },
  {
   "color": "d876e3",
   "description": "Further information is requested",
   "name": "question"
  },
  {
   "color": "ffffff",
   "description": "This will not be worked on",
   "name": "wontfix"
  }
 ],
 "language": "Python",
 "languages": {
  "Batchfile": 1168,
  "Python": 967721
 },
 "license": "MIT",
 "owner": "CompleteTech-ManageEngine",
 "repo": "sdp-cloud-readiness",
 "stargazers_count": 0,
 "topics": [],
 "visibility": "public"
}