{
 "archived": false,
 "created_at": "2026-04-06T14:21:10Z",
 "default_branch": "master",
 "description": "Obsidian research wiki on latent-space reasoning and inter-agent communication beyond the discrete token bottleneck",
 "fork": false,
 "has_discussions": false,
 "has_issues": true,
 "has_projects": true,
 "has_wiki": false,
 "health_percentage": 100,
 "homepage": null,
 "is_template": false,
 "labels": [
  {
   "color": "d73a4a",
   "description": "Something isn't working",
   "name": "bug"
  },
  {
   "color": "0075ca",
   "description": "Improvements or additions to documentation",
   "name": "documentation"
  },
  {
   "color": "cfd3d7",
   "description": "This issue or pull request already exists",
   "name": "duplicate"
  },
  {
   "color": "a2eeef",
   "description": "New feature or request",
   "name": "enhancement"
  },
  {
   "color": "7057ff",
   "description": "Good for newcomers",
   "name": "good first issue"
  },
  {
   "color": "008672",
   "description": "Extra attention is needed",
   "name": "help wanted"
  },
  {
   "color": "e4e669",
   "description": "This doesn't seem right",
   "name": "invalid"
  },
  {
   "color": "d876e3",
   "description": "Further information is requested",
   "name": "question"
  },
  {
   "color": "ffffff",
   "description": "This will not be worked on",
   "name": "wontfix"
  }
 ],
 "language": "Python",
 "languages": {
  "Python": 19578
 },
 "license": "NOASSERTION",
 "owner": "CompleteTech-LLC-AI-Research",
 "repo": "beyond-the-token-bottleneck",
 "stargazers_count": 41,
 "topics": [
  "complete-tech-ai-research",
  "latent-reasoning",
  "llm",
  "multi-agent",
  "obsidian",
  "research-wiki"
 ],
 "visibility": "public"
}