{
 "archived": false,
 "created_at": "2026-10-24T02:27:51Z",
 "default_branch": "main",
 "description": "An open-source, real-time moderated whiteboard Discord Activity with collaborative drawing, Discord role-based editing, persistent boards, secure moderation, and GoDaddy self-hosting.",
 "fork": false,
 "has_discussions": true,
 "has_issues": true,
 "has_projects": true,
 "has_wiki": true,
 "health_percentage": 87,
 "homepage": null,
 "is_template": false,
 "labels": [
  {
   "color": "f143ab",
   "description": "Barrier affecting people with disabilities",
   "name": "accessibility"
  },
  {
   "color": "d73a4a",
   "description": "Something isn't working",
   "name": "bug"
  },
  {
   "color": "0366d6",
   "description": "Pull requests that update a dependency file",
   "name": "dependencies"
  },
  {
   "color": "0075ca",
   "description": "Improvements or additions to documentation",
   "name": "documentation"
  },
  {
   "color": "cfd3d7",
   "description": "This issue or pull request already exists",
   "name": "duplicate"
  },
  {
   "color": "a2eeef",
   "description": "New feature or request",
   "name": "enhancement"
  },
  {
   "color": "000000",
   "description": "Pull requests that update GitHub Actions code",
   "name": "github_actions"
  },
  {
   "color": "7057ff",
   "description": "Good for newcomers",
   "name": "good first issue"
  },
  {
   "color": "008672",
   "description": "Extra attention is needed",
   "name": "help wanted"
  },
  {
   "color": "e4e669",
   "description": "This doesn't seem right",
   "name": "invalid"
  },
  {
   "color": "d876e3",
   "description": "Further information is requested",
   "name": "question"
  },
  {
   "color": "0e8a16",
   "description": "Planned release scope: mvp",
   "name": "release: mvp"
  },
  {
   "color": "0e8a16",
   "description": "Planned release scope: post-v1.0",
   "name": "release: post-v1.0"
  },
  {
   "color": "0e8a16",
   "description": "Planned release scope: v1.0",
   "name": "release: v1.0"
  },
  {
   "color": "0969da",
   "description": "Engineering scope: accessibility",
   "name": "topic: accessibility"
  },
  {
   "color": "0969da",
   "description": "Engineering scope: api",
   "name": "topic: api"
  },
  {
   "color": "0969da",
   "description": "Engineering scope: assets",
   "name": "topic: assets"
  },
  {
   "color": "0969da",
   "description": "Engineering scope: authorization",
   "name": "topic: authorization"
  },
  {
   "color": "0969da",
   "description": "Engineering scope: canvas",
   "name": "topic: canvas"
  },
  {
   "color": "0969da",
   "description": "Engineering scope: ci-cd",
   "name": "topic: ci-cd"
  },
  {
   "color": "0969da",
   "description": "Engineering scope: concurrency",
   "name": "topic: concurrency"
  },
  {
   "color": "0969da",
   "description": "Engineering scope: database",
   "name": "topic: database"
  },
  {
   "color": "0969da",
   "description": "Engineering scope: deployment",
   "name": "topic: deployment"
  },
  {
   "color": "0969da",
   "description": "Engineering scope: discord-bot",
   "name": "topic: discord-bot"
  },
  {
   "color": "0969da",
   "description": "Engineering scope: discord-oauth",
   "name": "topic: discord-oauth"
  },
  {
   "color": "0969da",
   "description": "Engineering scope: discord-sdk",
   "name": "topic: discord-sdk"
  },
  {
   "color": "0969da",
   "description": "Engineering scope: documentation",
   "name": "topic: documentation"
  },
  {
   "color": "0969da",
   "description": "Engineering scope: excalidraw",
   "name": "topic: excalidraw"
  },
  {
   "color": "0969da",
   "description": "Engineering scope: godaddy",
   "name": "topic: godaddy"
  },
  {
   "color": "0969da",
   "description": "Engineering scope: guild-roles",
   "name": "topic: guild-roles"
  },
  {
   "color": "0969da",
   "description": "Engineering scope: moderation",
   "name": "topic: moderation"
  },
  {
   "color": "0969da",
   "description": "Engineering scope: observability",
   "name": "topic: observability"
  },
  {
   "color": "0969da",
   "description": "Engineering scope: performance",
   "name": "topic: performance"
  },
  {
   "color": "0969da",
   "description": "Engineering scope: persistence",
   "name": "topic: persistence"
  },
  {
   "color": "0969da",
   "description": "Engineering scope: privacy",
   "name": "topic: privacy"
  },
  {
   "color": "0969da",
   "description": "Engineering scope: recovery",
   "name": "topic: recovery"
  },
  {
   "color": "0969da",
   "description": "Engineering scope: security",
   "name": "topic: security"
  },
  {
   "color": "0969da",
   "description": "Engineering scope: synchronization",
   "name": "topic: synchronization"
  },
  {
   "color": "0969da",
   "description": "Engineering scope: testing",
   "name": "topic: testing"
  },
  {
   "color": "0969da",
   "description": "Engineering scope: ui",
   "name": "topic: ui"
  },
  {
   "color": "0969da",
   "description": "Engineering scope: websockets",
   "name": "topic: websockets"
  },
  {
   "color": "d73a4a",
   "description": "Automated audit detected missing or inconsistent planning metadata",
   "name": "triage: incomplete"
  },
  {
   "color": "5319e7",
   "description": "Work item classification: bug",
   "name": "type: bug"
  },
  {
   "color": "5319e7",
   "description": "Work item classification: capability",
   "name": "type: capability"
  },
  {
   "color": "5319e7",
   "description": "Work item classification: documentation",
   "name": "type: documentation"
  },
  {
   "color": "5319e7",
   "description": "Work item classification: feature",
   "name": "type: feature"
  },
  {
   "color": "5319e7",
   "description": "Work item classification: operations",
   "name": "type: operations"
  },
  {
   "color": "5319e7",
   "description": "Work item classification: research",
   "name": "type: research"
  },
  {
   "color": "5319e7",
   "description": "Work item classification: security",
   "name": "type: security"
  },
  {
   "color": "5319e7",
   "description": "Work item classification: specification",
   "name": "type: specification"
  },
  {
   "color": "5319e7",
   "description": "Work item classification: subtask",
   "name": "type: subtask"
  },
  {
   "color": "5319e7",
   "description": "Work item classification: task",
   "name": "type: task"
  },
  {
   "color": "5319e7",
   "description": "Work item classification: test",
   "name": "type: test"
  },
  {
   "color": "5319e7",
   "description": "Work item classification: workstream",
   "name": "type: workstream"
  },
  {
   "color": "ffffff",
   "description": "This will not be worked on",
   "name": "wontfix"
  }
 ],
 "language": "Python",
 "languages": {
  "Makefile": 159,
  "Python": 100510
 },
 "license": "MIT",
 "owner": "CompleteTech-DiscordApps",
 "repo": "guildboard",
 "stargazers_count": 0,
 "topics": [
  "collaboration",
  "discord",
  "discord-activity",
  "excalidraw",
  "godaddy",
  "moderation",
  "open-source",
  "react",
  "realtime",
  "self-hosted",
  "typescript",
  "websockets",
  "whiteboard"
 ],
 "visibility": "public"
}