{
 "archived": false,
 "created_at": "2025-03-05T17:14:35Z",
 "default_branch": "main",
 "description": "Modular AI agent system combining language models with shell command execution and file manipulation",
 "fork": false,
 "has_discussions": false,
 "has_issues": true,
 "has_projects": true,
 "has_wiki": false,
 "health_percentage": 87,
 "homepage": null,
 "is_template": false,
 "labels": [
  {
   "color": "d73a4a",
   "description": "Something isn't working",
   "name": "bug"
  },
  {
   "color": "0075ca",
   "description": "Improvements or additions to documentation",
   "name": "documentation"
  },
  {
   "color": "cfd3d7",
   "description": "This issue or pull request already exists",
   "name": "duplicate"
  },
  {
   "color": "a2eeef",
   "description": "New feature or request",
   "name": "enhancement"
  },
  {
   "color": "7057ff",
   "description": "Good for newcomers",
   "name": "good first issue"
  },
  {
   "color": "008672",
   "description": "Extra attention is needed",
   "name": "help wanted"
  },
  {
   "color": "e4e669",
   "description": "This doesn't seem right",
   "name": "invalid"
  },
  {
   "color": "d876e3",
   "description": "Further information is requested",
   "name": "question"
  },
  {
   "color": "ffffff",
   "description": "This will not be worked on",
   "name": "wontfix"
  }
 ],
 "language": "Python",
 "languages": {
  "Python": 36704
 },
 "license": "MIT",
 "owner": "CompleteTech-LLC-AI-Research",
 "repo": "ai-self-replication-study",
 "stargazers_count": 4,
 "topics": [
  "ai-agents",
  "complete-tech-ai-research",
  "llm",
  "ollama",
  "python"
 ],
 "visibility": "public"
}