{
 "archived": false,
 "created_at": "2026-10-23T23:40:59Z",
 "default_branch": "main",
 "description": "Standalone defensive checker project for CVE-2026-19489: Citrix NetScaler ADC / Gateway: LSN SIP ALG memory corruption. One exploit per repository; implementation pending.",
 "fork": false,
 "has_discussions": false,
 "has_issues": true,
 "has_projects": true,
 "has_wiki": true,
 "health_percentage": 75,
 "homepage": null,
 "is_template": false,
 "labels": [
  {
   "color": "d73a4a",
   "description": "Something isn't working",
   "name": "bug"
  },
  {
   "color": "0075ca",
   "description": "Improvements or additions to documentation",
   "name": "documentation"
  },
  {
   "color": "cfd3d7",
   "description": "This issue or pull request already exists",
   "name": "duplicate"
  },
  {
   "color": "a2eeef",
   "description": "New feature or request",
   "name": "enhancement"
  },
  {
   "color": "7057ff",
   "description": "Good for newcomers",
   "name": "good first issue"
  },
  {
   "color": "008672",
   "description": "Extra attention is needed",
   "name": "help wanted"
  },
  {
   "color": "e4e669",
   "description": "This doesn't seem right",
   "name": "invalid"
  },
  {
   "color": "d876e3",
   "description": "Further information is requested",
   "name": "question"
  },
  {
   "color": "ffffff",
   "description": "This will not be worked on",
   "name": "wontfix"
  }
 ],
 "language": "Python",
 "languages": {
  "Python": 64243
 },
 "license": "AGPL-3.0",
 "owner": "CompleTetech-Security",
 "repo": "netscaler-cve-2026-19489-check",
 "stargazers_count": 0,
 "topics": [],
 "visibility": "public"
}